{
  "id": "17895695668004550",
  "caption": "Beautiful sunset at the beach! #photography #nature",
  "media_type": "IMAGE",
  "media_url": "https://scontent.cdninstagram.com/v/photo.jpg",
  "permalink": "https://www.instagram.com/p/ABC123/",
  "timestamp": "2026-04-18T15:30:00+0000",
  "like_count": 1500,
  "comments_count": 45
}
